{"bobVersion":"0.1.0","configs":[{"features":{},"id":"linux-amd64+debug+ubsan+fast","named":["fast"],"platform":"linux-amd64","profile":"debug","race":false,"sanitizers":["ubsan"]},{"features":{},"id":"linux-arm64","named":[],"platform":"linux-arm64","profile":"release","race":false,"sanitizers":[]}],"irVersion":1,"module":"example.com/t","nodes":[{"definedAt":{"col":22,"file":"eval_test.go","line":51},"deps":[],"id":"//:gen@linux-arm64","kind":"test.tool","label":"//:gen","proj":{"platform":"linux-arm64"},"spec":{"name":"gen"},"srcs":[]},{"definedAt":{"col":22,"file":"eval_test.go","line":51},"deps":["//:version.v.txt@linux-amd64"],"id":"//:lib@linux-amd64+debug+ubsan","kind":"test.prof","label":"//:lib","proj":{"platform":"linux-amd64","profile":"debug","sanitizers":["ubsan"]},"spec":{"name":"lib"},"srcs":[]},{"definedAt":{"col":22,"file":"eval_test.go","line":51},"deps":["//:version.v.txt@linux-arm64"],"id":"//:lib@linux-arm64","kind":"test.prof","label":"//:lib","proj":{"platform":"linux-arm64","profile":"release","sanitizers":[]},"spec":{"name":"lib"},"srcs":[]},{"definedAt":{"col":70,"file":"eval_test.go","line":299},"deps":["//:version@linux-amd64"],"id":"//:version.v.txt@linux-amd64","kind":"bob.file","label":"//:version.v.txt","proj":{"platform":"linux-amd64"},"spec":{"path":"v.txt"},"srcs":[]},{"definedAt":{"col":70,"file":"eval_test.go","line":299},"deps":["//:version@linux-arm64"],"id":"//:version.v.txt@linux-arm64","kind":"bob.file","label":"//:version.v.txt","proj":{"platform":"linux-arm64"},"spec":{"path":"v.txt"},"srcs":[]},{"definedAt":{"col":10,"file":"eval_test.go","line":290},"deps":["//:gen@linux-arm64","//:zlib-1.3.1.tar.gz"],"id":"//:version@linux-amd64","kind":"bob.run","label":"//:version","proj":{"platform":"linux-amd64"},"spec":{"cmd":["gen","${BOB_OUT}/v.txt"],"env":{"A":"<b>"},"inputs":{"ZLIB":1},"outputs":["v.txt"],"timeoutSeconds":1800,"tools":1},"srcs":[{"dir":"","patterns":["*.go","!*_test.go","go.mod","testdata/**"]}]},{"definedAt":{"col":10,"file":"eval_test.go","line":290},"deps":["//:gen@linux-arm64","//:zlib-1.3.1.tar.gz"],"id":"//:version@linux-arm64","kind":"bob.run","label":"//:version","proj":{"platform":"linux-arm64"},"spec":{"cmd":["gen","${BOB_OUT}/v.txt"],"env":{"A":"<b>"},"inputs":{"ZLIB":1},"outputs":["v.txt"],"timeoutSeconds":1800,"tools":1},"srcs":[{"dir":"","patterns":["*.go","!*_test.go","go.mod","testdata/**"]}]},{"definedAt":{"col":10,"file":"eval_test.go","line":287},"deps":[],"id":"//:zlib-1.3.1.tar.gz","kind":"bob.fetch","label":"//:zlib-1.3.1.tar.gz","proj":{},"spec":{"archive":true,"mirrors":[],"name":"","strip":1,"url":"https://example.org/zlib-1.3.1.tar.gz"},"srcs":[]}],"pipelines":[{"concurrency":"supersede","name":"ci","releases":[],"targets":["//..."],"tests":[],"triggers":["push main","pull_request"]}],"repo":{"nixpkgs":"nixos-26.05","variants":[{"features":{},"name":"fast","profile":"debug","race":false,"sanitizers":["ubsan"]}]},"roots":["//:gen@linux-arm64","//:lib@linux-amd64+debug+ubsan","//:lib@linux-arm64","//:version.v.txt@linux-arm64","//:version@linux-arm64","//:zlib-1.3.1.tar.gz"]}
